{
  "schemaVersion": "1.0",
  "bundleId": "nt51919-nt51929-nt51932-shared-facts",
  "bundleVersion": "1.1.13-tp-svn.1",
  "hashAlgorithm": "sha256-rfc8785-entry-array-v1",
  "contentHash": "8d214b985da301e115553f88702290867ac2698e781c82c7579bab50be5dba50",
  "trustAnchorBindingId": "built-in-profile-bundle-v2",
  "entries": [
    {
      "entryId": "firmware-family-v1-schema",
      "kind": "schema",
      "path": "schemas/firmware-family-v1.schema.json",
      "schemaId": "https://example.invalid/nfc/schemas/firmware-family-v1.schema.json",
      "contentHash": "bf894058eeba46648b3b480cd61cc6c3e8c138d550d4f6725c5d49bc4ff19514"
    },
    {
      "entryId": "nt51929-nt51932-family",
      "kind": "firmware-family",
      "path": "families/nt51929-nt51932.json",
      "schemaId": "https://example.invalid/nfc/schemas/firmware-family-v1.schema.json",
      "contentHash": "0d3e0ac10ab8c726925e46f1383c2202ab85e9bff896e38468dd1038556c3b9a"
    }
  ]
}
