{
  "schemaVersion": "1.0",
  "bundleId": "nt51927-standard-merge-family",
  "bundleVersion": "1.1.13-tp-svn.1",
  "hashAlgorithm": "sha256-rfc8785-entry-array-v1",
  "contentHash": "59b51e5357fd7567315c6cc85289e2d5d78783e6ed027c421409c4a7f8cc6584",
  "trustAnchorBindingId": "built-in-profile-bundle-v2",
  "entries": [
    {
      "entryId": "composition-profile-v2-schema",
      "kind": "schema",
      "path": "schemas/composition-profile-v2.schema.json",
      "schemaId": "https://example.invalid/nfc/schemas/composition-profile-v2.schema.json",
      "contentHash": "2c64c846abfb81e5c3a6fbc837238e25a33ecc0ed32de54f32cb944750734a25"
    },
    {
      "entryId": "firmware-family-v1-schema",
      "kind": "schema",
      "path": "schemas/firmware-family-v1.schema.json",
      "schemaId": "https://example.invalid/nfc/schemas/firmware-family-v1.schema.json",
      "contentHash": "d35c8b8b5113c8f8a5d8b6567a8e2a00d24fd8b440c2ba5836187a824002f83c"
    },
    {
      "entryId": "nt51927-nt51928-family",
      "kind": "firmware-family",
      "path": "families/nt51927-nt51928.json",
      "schemaId": "https://example.invalid/nfc/schemas/firmware-family-v1.schema.json",
      "contentHash": "cb54fb90a1bf846cf737f5cd02de31c203540567dc66c209cad8a8e3ef0bbfb2"
    },
    {
      "entryId": "nt51917-standard-merge-profile",
      "kind": "composition-profile",
      "path": "profiles/nt51917-standard-merge.json",
      "schemaId": "https://example.invalid/nfc/schemas/composition-profile-v2.schema.json",
      "contentHash": "cf381515437ad2bc44e103d68971ba8e21b89a482844ac79668f40a47cccfd46"
    },
    {
      "entryId": "nt51927-standard-merge-profile",
      "kind": "composition-profile",
      "path": "profiles/nt51927-standard-merge.json",
      "schemaId": "https://example.invalid/nfc/schemas/composition-profile-v2.schema.json",
      "contentHash": "40658f6092f426236463bed3c9346b718cc30b8e3a53409ffbe518b4e5268e18"
    }
  ]
}
