{
  "schemaVersion": "1.0",
  "bundleId": "nt51931-dp-replace-family",
  "bundleVersion": "0.10.1-dpcmi.1",
  "hashAlgorithm": "sha256-rfc8785-entry-array-v1",
  "contentHash": "6a0b3e953a6df1b3026b850dd548634cc56e43fb0a1abbb0746a0f1484e26301",
  "trustAnchorBindingId": "built-in-profile-bundle-v2",
  "entries": [
    { "entryId": "composition-profile-v2-schema", "kind": "schema", "path": "schemas/composition-profile-v2.schema.json", "schemaId": "https://example.invalid/nfc/schemas/composition-profile-v2.schema.json", "contentHash": "1af166d37379329cc7a298ea24637a665b183f286e5a2323d4ed014e893dc9f0" },
    { "entryId": "firmware-family-v1-schema", "kind": "schema", "path": "schemas/firmware-family-v1.schema.json", "schemaId": "https://example.invalid/nfc/schemas/firmware-family-v1.schema.json", "contentHash": "01416bca0e005245b0f51f9d3d78e438cb202e66a654614c99b9f2ed41ce581a" },
    { "entryId": "nt51931-family", "kind": "firmware-family", "path": "families/nt51931.json", "schemaId": "https://example.invalid/nfc/schemas/firmware-family-v1.schema.json", "contentHash": "cf3f2b0556ccdd9387c6da58c704cbac4c8fddc559919d19eafbce847580f159" },
    { "entryId": "nt51931-dp-replace-profile", "kind": "composition-profile", "path": "profiles/nt51931-dp-replace.json", "schemaId": "https://example.invalid/nfc/schemas/composition-profile-v2.schema.json", "contentHash": "fc16e0823a8c924d2008dd41f582a950e2e3a10d29bf8ed5eafa731690bb76a9" }
  ]
}
