{
  "schemaVersion": "1.0",
  "bundleId": "nt51950-nt51951-general-merge-logical-candidate",
  "bundleVersion": "1.1.13-tp-svn.1",
  "hashAlgorithm": "sha256-rfc8785-entry-array-v1",
  "contentHash": "973966b55ab64092166b45dc000d8be60a49d4a93068611cddb835ce5e3496eb",
  "trustAnchorBindingId": "built-in-profile-bundle-v2",
  "entries": [
    {
      "entryId": "composition-profile-v2-schema",
      "kind": "schema",
      "path": "schemas/composition-profile-v2.schema.json",
      "schemaId": "https://example.invalid/nfc/schemas/composition-profile-v2.schema.json",
      "contentHash": "ab3bed384c5d78590ad6a87ee23c12f23a1ea4a1bdc6001273f254b6e5f3547f"
    },
    {
      "entryId": "firmware-family-v1-schema",
      "kind": "schema",
      "path": "schemas/firmware-family-v1.schema.json",
      "schemaId": "https://example.invalid/nfc/schemas/firmware-family-v1.schema.json",
      "contentHash": "bf894058eeba46648b3b480cd61cc6c3e8c138d550d4f6725c5d49bc4ff19514"
    },
    {
      "entryId": "nt51950-nt51951-dp-perspective-family",
      "kind": "firmware-family",
      "path": "families/nt51950-nt51951-dp-perspective.json",
      "schemaId": "https://example.invalid/nfc/schemas/firmware-family-v1.schema.json",
      "contentHash": "ae88f7e08efcf52d4eba0ee043ab9d609279691741c77e8d1eca660c60e2d74d"
    },
    {
      "entryId": "nt51950-general-merge-logical-candidate-profile",
      "kind": "composition-profile",
      "path": "profiles/nt51950-general-merge-logical-candidate.json",
      "schemaId": "https://example.invalid/nfc/schemas/composition-profile-v2.schema.json",
      "contentHash": "19ae1170c8a304286f4aaaf2c1884c5e5c1ae45e984121760f73b42ad6d379a4"
    },
    {
      "entryId": "nt51951-general-merge-logical-candidate-profile",
      "kind": "composition-profile",
      "path": "profiles/nt51951-general-merge-logical-candidate.json",
      "schemaId": "https://example.invalid/nfc/schemas/composition-profile-v2.schema.json",
      "contentHash": "037aa1f8e4be13af15b46882e790c36c6988006e8691da96a7e0cb1d95b0f17d"
    }
  ]
}
