{
  "schemaVersion": "1.0",
  "bundleId": "nt51925-ctrlram-replace-candidate",
  "bundleVersion": "1.2.2-nt51925.1",
  "hashAlgorithm": "sha256-rfc8785-entry-array-v1",
  "contentHash": "269a2e4f36a5275fd63d1982882f0321719212356963691cd69978ed7a85fd6b",
  "trustAnchorBindingId": "built-in-profile-bundle-v2",
  "entries": [
    {
      "entryId": "composition-profile-v2-schema",
      "kind": "schema",
      "path": "schemas/composition-profile-v2.schema.json",
      "schemaId": "https://example.invalid/nfc/schemas/composition-profile-v2.schema.json",
      "contentHash": "59fa0e240bdde76db530457219d5d41b2bcb47d90428fb48b8f94a83f516e051"
    },
    {
      "entryId": "firmware-family-v1-schema",
      "kind": "schema",
      "path": "schemas/firmware-family-v1.schema.json",
      "schemaId": "https://example.invalid/nfc/schemas/firmware-family-v1.schema.json",
      "contentHash": "695e43c4c89b647b83333a776dc26e2a27b925c46448048ef0c38e839456a0e3"
    },
    {
      "entryId": "nt51925-ctrlram-replace-family",
      "kind": "firmware-family",
      "path": "families/nt51925-ctrlram-replace.json",
      "schemaId": "https://example.invalid/nfc/schemas/firmware-family-v1.schema.json",
      "contentHash": "83d899082fd2d2fe452a2d49395c8df0c875c2ac9ca308bb75c87e62175140d4"
    },
    {
      "entryId": "nt51925-ctrlram-replace-fw141-runtime-single-profile",
      "kind": "composition-profile",
      "path": "profiles/nt51925-ctrlram-replace-fw141-runtime-single.json",
      "schemaId": "https://example.invalid/nfc/schemas/composition-profile-v2.schema.json",
      "contentHash": "9f3ba58942358fcb8851b85509b50ff1296a5735b47a12594a8f4c6385a1aac0"
    },
    {
      "entryId": "nt51925-ctrlram-replace-fw141-runtime-cascade-profile",
      "kind": "composition-profile",
      "path": "profiles/nt51925-ctrlram-replace-fw141-runtime-cascade.json",
      "schemaId": "https://example.invalid/nfc/schemas/composition-profile-v2.schema.json",
      "contentHash": "9a5fb8a4c50e0b9fe2cfa7cc0ba0a9b548779fb47d5d910b939f2c5cd6ba5ec6"
    },
    {
      "entryId": "nt51925-ctrlram-replace-fw200-runtime-single-profile",
      "kind": "composition-profile",
      "path": "profiles/nt51925-ctrlram-replace-fw200-runtime-single.json",
      "schemaId": "https://example.invalid/nfc/schemas/composition-profile-v2.schema.json",
      "contentHash": "ebf460c2daa33e8a05705e2b6870a7cb84287fe3c5c09db628275c0b2cd5d310"
    },
    {
      "entryId": "nt51925-ctrlram-replace-fw200-runtime-cascade-profile",
      "kind": "composition-profile",
      "path": "profiles/nt51925-ctrlram-replace-fw200-runtime-cascade.json",
      "schemaId": "https://example.invalid/nfc/schemas/composition-profile-v2.schema.json",
      "contentHash": "e665c28e9ead1f0d63cef05f4032108436e1be9a3859982ad38809b06f4ae82a"
    }
  ]
}
