{
  "schemaVersion": "1.0",
  "bundleId": "nt51923-dp-replace-family",
  "bundleVersion": "1.1.10-full-image-metadata.1",
  "hashAlgorithm": "sha256-rfc8785-entry-array-v1",
  "contentHash": "532f71f4431e74e0cccd497dc2b06d97b35e34608ff6f7ce9208e10cb65822d8",
  "trustAnchorBindingId": "built-in-profile-bundle-v2",
  "entries": [
    {
      "entryId": "composition-profile-v2-schema",
      "kind": "schema",
      "path": "schemas/composition-profile-v2.schema.json",
      "schemaId": "https://example.invalid/nfc/schemas/composition-profile-v2.schema.json",
      "contentHash": "2c64c846abfb81e5c3a6fbc837238e25a33ecc0ed32de54f32cb944750734a25"
    },
    {
      "entryId": "firmware-family-v1-schema",
      "kind": "schema",
      "path": "schemas/firmware-family-v1.schema.json",
      "schemaId": "https://example.invalid/nfc/schemas/firmware-family-v1.schema.json",
      "contentHash": "bf894058eeba46648b3b480cd61cc6c3e8c138d550d4f6725c5d49bc4ff19514"
    },
    {
      "entryId": "nt51923-nt51926-family",
      "kind": "firmware-family",
      "path": "families/nt51923-nt51926.json",
      "schemaId": "https://example.invalid/nfc/schemas/firmware-family-v1.schema.json",
      "contentHash": "f3b092b567c6bad47bd20594a6b79547bec35fc2a683f493f3f7d22121a22fb6"
    },
    {
      "entryId": "nt51923-dp-replace-profile",
      "kind": "composition-profile",
      "path": "profiles/nt51923-dp-replace.json",
      "schemaId": "https://example.invalid/nfc/schemas/composition-profile-v2.schema.json",
      "contentHash": "7070177b96bbf6293b24395828b471efe253a45faa36b222c06824aff4cf3f96"
    },
    {
      "entryId": "nt51926-dp-replace-profile",
      "kind": "composition-profile",
      "path": "profiles/nt51926-dp-replace.json",
      "schemaId": "https://example.invalid/nfc/schemas/composition-profile-v2.schema.json",
      "contentHash": "31d30f086fdbaa19732302ea1ed29c42cb82cc76df5549e45b142d31791f815d"
    }
  ]
}
