{
  "schemaVersion": "1.0",
  "bundleId": "nt51951-ctrlram-replace-candidate",
  "bundleVersion": "1.1.13-tp-svn.1",
  "hashAlgorithm": "sha256-rfc8785-entry-array-v1",
  "contentHash": "6f13c26b5bf5a95d13e0b7004fc95ab5fa90da61c2cceee6b60ba41cdc9df1fa",
  "trustAnchorBindingId": "built-in-profile-bundle-v2",
  "entries": [
    {
      "entryId": "composition-profile-v2-schema",
      "kind": "schema",
      "path": "schemas/composition-profile-v2.schema.json",
      "schemaId": "https://example.invalid/nfc/schemas/composition-profile-v2.schema.json",
      "contentHash": "59fa0e240bdde76db530457219d5d41b2bcb47d90428fb48b8f94a83f516e051"
    },
    {
      "entryId": "firmware-family-v1-schema",
      "kind": "schema",
      "path": "schemas/firmware-family-v1.schema.json",
      "schemaId": "https://example.invalid/nfc/schemas/firmware-family-v1.schema.json",
      "contentHash": "695e43c4c89b647b83333a776dc26e2a27b925c46448048ef0c38e839456a0e3"
    },
    {
      "entryId": "nt51951-ctrlram-replace-family",
      "kind": "firmware-family",
      "path": "families/nt51951-ctrlram-replace.json",
      "schemaId": "https://example.invalid/nfc/schemas/firmware-family-v1.schema.json",
      "contentHash": "f697bf53fba46bc8d0253aff05cd347d45a09e1dba571bfef9d0cab7234752b4"
    },
    {
      "entryId": "nt51951-ctrlram-replace-fw200-single-profile",
      "kind": "composition-profile",
      "path": "profiles/nt51951-ctrlram-replace-fw200-single.json",
      "schemaId": "https://example.invalid/nfc/schemas/composition-profile-v2.schema.json",
      "contentHash": "04422935b8d3ce95b045c704fdf3dcdf573e1cedfb30d8e94c6492a29efe7976"
    },
    {
      "entryId": "nt51951-ctrlram-replace-fw1x-cascade-profile",
      "kind": "composition-profile",
      "path": "profiles/nt51951-ctrlram-replace-fw1x-cascade.json",
      "schemaId": "https://example.invalid/nfc/schemas/composition-profile-v2.schema.json",
      "contentHash": "66a57ccd545e977a346e8cbb6a47801b96a268362910c5927407435be23e32fd"
    }
  ]
}
