{
  "schemaVersion": "1.0",
  "bundleId": "nt51920-ctrlram-replace-candidate",
  "bundleVersion": "0.9.12-candidate.1",
  "hashAlgorithm": "sha256-rfc8785-entry-array-v1",
  "contentHash": "7394b8c650200fd6bb608312f1bf5177c5f1edf21cf9d485c7d5d5406d8a1b06",
  "trustAnchorBindingId": "built-in-profile-bundle-v2",
  "entries": [
    {
      "entryId": "composition-profile-v2-schema",
      "kind": "schema",
      "path": "schemas/composition-profile-v2.schema.json",
      "schemaId": "https://example.invalid/nfc/schemas/composition-profile-v2.schema.json",
      "contentHash": "59fa0e240bdde76db530457219d5d41b2bcb47d90428fb48b8f94a83f516e051"
    },
    {
      "entryId": "firmware-family-v1-schema",
      "kind": "schema",
      "path": "schemas/firmware-family-v1.schema.json",
      "schemaId": "https://example.invalid/nfc/schemas/firmware-family-v1.schema.json",
      "contentHash": "0dd353296e02e448dcc653028fd3b3ce6ad7fdd8e11a1ce11a465b46f0b471d7"
    },
    {
      "entryId": "nt51920-ctrlram-replace-family",
      "kind": "firmware-family",
      "path": "families/nt51920-ctrlram-replace.json",
      "schemaId": "https://example.invalid/nfc/schemas/firmware-family-v1.schema.json",
      "contentHash": "92cd18bfb32e0c9c63ea845eac2f2e09ce69bc4708b239fbe1e0f1487c90fa2a"
    },
    {
      "entryId": "nt51920-ctrlram-replace-fw120-cascade2-profile",
      "kind": "composition-profile",
      "path": "profiles/nt51920-ctrlram-replace-fw120-cascade2.json",
      "schemaId": "https://example.invalid/nfc/schemas/composition-profile-v2.schema.json",
      "contentHash": "62804718e4b57e6d45aa33efe3b0f137b759803169d1ab2838ec7799edc9da19"
    },
    {
      "entryId": "nt51920-ctrlram-replace-fw120-single-profile",
      "kind": "composition-profile",
      "path": "profiles/nt51920-ctrlram-replace-fw120-single.json",
      "schemaId": "https://example.invalid/nfc/schemas/composition-profile-v2.schema.json",
      "contentHash": "6b8402df4e2ba5baf330d9a70c367c251c37cc3f8e5b522e5985de085922f4b6"
    }
  ]
}
