{
  "schemaVersion": "1.0",
  "bundleId": "nt51917-nt51927-shared-facts",
  "bundleVersion": "1.1.13-tp-svn.1",
  "hashAlgorithm": "sha256-rfc8785-entry-array-v1",
  "contentHash": "c76b575da7b28cbd920712fc2b0279f7872bb109c22fb788ee02ae72c2632f8d",
  "trustAnchorBindingId": "built-in-profile-bundle-v2",
  "entries": [
    {
      "entryId": "firmware-family-v1-schema",
      "kind": "schema",
      "path": "schemas/firmware-family-v1.schema.json",
      "schemaId": "https://example.invalid/nfc/schemas/firmware-family-v1.schema.json",
      "contentHash": "bf894058eeba46648b3b480cd61cc6c3e8c138d550d4f6725c5d49bc4ff19514"
    },
    {
      "entryId": "nt51927-family",
      "kind": "firmware-family",
      "path": "families/nt51927.json",
      "schemaId": "https://example.invalid/nfc/schemas/firmware-family-v1.schema.json",
      "contentHash": "6d15de007e843e45fb8aa78f081f601f5f6f890415774801df263756a020394d"
    }
  ]
}
