{
  "schemaVersion": "1.0",
  "bundleId": "nt51931-standard-merge-family",
  "bundleVersion": "0.9.1-v2-candidate.1",
  "hashAlgorithm": "sha256-rfc8785-entry-array-v1",
  "contentHash": "a7b3534afce6d2fe107363e41554668a71832f203168c81fa09e9f98a1a5815f",
  "trustAnchorBindingId": "built-in-profile-bundle-v2",
  "entries": [
    {
      "entryId": "composition-profile-v2-schema",
      "kind": "schema",
      "path": "schemas/composition-profile-v2.schema.json",
      "schemaId": "https://example.invalid/nfc/schemas/composition-profile-v2.schema.json",
      "contentHash": "1af166d37379329cc7a298ea24637a665b183f286e5a2323d4ed014e893dc9f0"
    },
    {
      "entryId": "firmware-family-v1-schema",
      "kind": "schema",
      "path": "schemas/firmware-family-v1.schema.json",
      "schemaId": "https://example.invalid/nfc/schemas/firmware-family-v1.schema.json",
      "contentHash": "0dd353296e02e448dcc653028fd3b3ce6ad7fdd8e11a1ce11a465b46f0b471d7"
    },
    {
      "entryId": "nt51931-family",
      "kind": "firmware-family",
      "path": "families/nt51931.json",
      "schemaId": "https://example.invalid/nfc/schemas/firmware-family-v1.schema.json",
      "contentHash": "5fd7e70f374ebe22ad41912d6e2a786e891c33759cc2e169654ca4b9975c91a4"
    },
    {
      "entryId": "nt51931-standard-merge-profile",
      "kind": "composition-profile",
      "path": "profiles/nt51931-standard-merge.json",
      "schemaId": "https://example.invalid/nfc/schemas/composition-profile-v2.schema.json",
      "contentHash": "c12af66b1a55bc37883976e8188b206805575d0b91e5e0c464cb8e489c3e652e"
    }
  ]
}
