{
  "schemaVersion": "1.0",
  "bundleId": "nt51929-dp-replace-family",
  "bundleVersion": "1.1.10-full-image-metadata.1",
  "hashAlgorithm": "sha256-rfc8785-entry-array-v1",
  "contentHash": "807ca99b64c20fea5237f07f7ddb4a3daefb35e34e065a04def0fc410c10ca04",
  "trustAnchorBindingId": "built-in-profile-bundle-v2",
  "entries": [
    {
      "entryId": "composition-profile-v2-schema",
      "kind": "schema",
      "path": "schemas/composition-profile-v2.schema.json",
      "schemaId": "https://example.invalid/nfc/schemas/composition-profile-v2.schema.json",
      "contentHash": "97540ff527b8929726949629aa9fff46819be3a413f757c007a44a1025e31100"
    },
    {
      "entryId": "firmware-family-v1-schema",
      "kind": "schema",
      "path": "schemas/firmware-family-v1.schema.json",
      "schemaId": "https://example.invalid/nfc/schemas/firmware-family-v1.schema.json",
      "contentHash": "bf894058eeba46648b3b480cd61cc6c3e8c138d550d4f6725c5d49bc4ff19514"
    },
    {
      "entryId": "nt51919-dp-replace-profile",
      "kind": "composition-profile",
      "path": "profiles/nt51919-dp-replace.json",
      "schemaId": "https://example.invalid/nfc/schemas/composition-profile-v2.schema.json",
      "contentHash": "fc590784c51d349c2e020e7c733eba27c2f5c76dfc777c21fa5f1fac414cdc8c"
    },
    {
      "entryId": "nt51929-nt51932-family",
      "kind": "firmware-family",
      "path": "families/nt51929-nt51932.json",
      "schemaId": "https://example.invalid/nfc/schemas/firmware-family-v1.schema.json",
      "contentHash": "d2499758dd19908422f857e5b7a68c24c47ac57961418da82d10dec2f039f3e8"
    },
    {
      "entryId": "nt51929-dp-replace-profile",
      "kind": "composition-profile",
      "path": "profiles/nt51929-dp-replace.json",
      "schemaId": "https://example.invalid/nfc/schemas/composition-profile-v2.schema.json",
      "contentHash": "0ac0f3f0e59c07a7e42ce99b76c9ed85355e29064c75f78f22e6433e68d4e20a"
    },
    {
      "entryId": "nt51932-dp-replace-profile",
      "kind": "composition-profile",
      "path": "profiles/nt51932-dp-replace.json",
      "schemaId": "https://example.invalid/nfc/schemas/composition-profile-v2.schema.json",
      "contentHash": "85d7182a8e08deed12814d9b0b057144fbdfc942c01cd39f6259e94ac4721096"
    }
  ]
}
