{
  "schemaVersion": "1.0",
  "bundleId": "nt51950-nt51951-standard-merge",
  "bundleVersion": "1.1.13-tp-svn.1",
  "hashAlgorithm": "sha256-rfc8785-entry-array-v1",
  "contentHash": "ecffb254e15097f64f321e806bd9c6e8eeef478b5ae7f5d9ffd5e1eac8897e1f",
  "trustAnchorBindingId": "built-in-profile-bundle-v2",
  "entries": [
    {
      "entryId": "composition-profile-v2-schema",
      "kind": "schema",
      "path": "schemas/composition-profile-v2.schema.json",
      "schemaId": "https://example.invalid/nfc/schemas/composition-profile-v2.schema.json",
      "contentHash": "1c96e2fa029fc4f358324fac5b309061e15316238655d6939431e80219f06034"
    },
    {
      "entryId": "firmware-family-v1-schema",
      "kind": "schema",
      "path": "schemas/firmware-family-v1.schema.json",
      "schemaId": "https://example.invalid/nfc/schemas/firmware-family-v1.schema.json",
      "contentHash": "bf894058eeba46648b3b480cd61cc6c3e8c138d550d4f6725c5d49bc4ff19514"
    },
    {
      "entryId": "nt51950-nt51951-dp-perspective-family",
      "kind": "firmware-family",
      "path": "families/nt51950-nt51951-dp-perspective.json",
      "schemaId": "https://example.invalid/nfc/schemas/firmware-family-v1.schema.json",
      "contentHash": "ae88f7e08efcf52d4eba0ee043ab9d609279691741c77e8d1eca660c60e2d74d"
    },
    {
      "entryId": "nt51950-standard-merge-profile",
      "kind": "composition-profile",
      "path": "profiles/nt51950-standard-merge.json",
      "schemaId": "https://example.invalid/nfc/schemas/composition-profile-v2.schema.json",
      "contentHash": "b677238d899b200d5eecc2fb04beb138509b9b73abf178174a2a37e6b4432396"
    },
    {
      "entryId": "nt51951-standard-merge-profile",
      "kind": "composition-profile",
      "path": "profiles/nt51951-standard-merge.json",
      "schemaId": "https://example.invalid/nfc/schemas/composition-profile-v2.schema.json",
      "contentHash": "9a61be534dadd95ca51f603c4f5c8315369743a3f22d2ed5c6f781c1ea52fd19"
    }
  ]
}
