{
  "schemaVersion": "1.0",
  "bundleId": "nt51920-dp-replace-family",
  "bundleVersion": "0.9.11-dp-replace.1",
  "hashAlgorithm": "sha256-rfc8785-entry-array-v1",
  "contentHash": "54fe891836a8e899f3ac27c3dd32e35678032b3f0c886d6a2f2659369c7185a9",
  "trustAnchorBindingId": "built-in-profile-bundle-v2",
  "entries": [
    { "entryId": "composition-profile-v2-schema", "kind": "schema", "path": "schemas/composition-profile-v2.schema.json", "schemaId": "https://example.invalid/nfc/schemas/composition-profile-v2.schema.json", "contentHash": "1af166d37379329cc7a298ea24637a665b183f286e5a2323d4ed014e893dc9f0" },
    { "entryId": "firmware-family-v1-schema", "kind": "schema", "path": "schemas/firmware-family-v1.schema.json", "schemaId": "https://example.invalid/nfc/schemas/firmware-family-v1.schema.json", "contentHash": "0dd353296e02e448dcc653028fd3b3ce6ad7fdd8e11a1ce11a465b46f0b471d7" },
    { "entryId": "nt51920-family", "kind": "firmware-family", "path": "families/nt51920.json", "schemaId": "https://example.invalid/nfc/schemas/firmware-family-v1.schema.json", "contentHash": "22a1e41c1fc29f2d804a217b03ccf8012a8efea0300de3df8e797c5d04fb32ef" },
    { "entryId": "nt51920-dp-replace-profile", "kind": "composition-profile", "path": "profiles/nt51920-dp-replace.json", "schemaId": "https://example.invalid/nfc/schemas/composition-profile-v2.schema.json", "contentHash": "2549ed065eb37372832e2dde21999e8750f8b4cb713455260a4ee9f68665d927" }
  ]
}
