{
  "schemaVersion": "1.0",
  "bundleId": "nt51930-general-merge-logical-candidate",
  "bundleVersion": "0.9.5-candidate.1",
  "hashAlgorithm": "sha256-rfc8785-entry-array-v1",
  "contentHash": "dd94152806731536a7641b06b33ed177cc17e141032b705ed5b89956e3affc39",
  "trustAnchorBindingId": "built-in-profile-bundle-v2",
  "entries": [
    {
      "entryId": "composition-profile-v2-schema",
      "kind": "schema",
      "path": "schemas/composition-profile-v2.schema.json",
      "schemaId": "https://example.invalid/nfc/schemas/composition-profile-v2.schema.json",
      "contentHash": "ab3bed384c5d78590ad6a87ee23c12f23a1ea4a1bdc6001273f254b6e5f3547f"
    },
    {
      "entryId": "firmware-family-v1-schema",
      "kind": "schema",
      "path": "schemas/firmware-family-v1.schema.json",
      "schemaId": "https://example.invalid/nfc/schemas/firmware-family-v1.schema.json",
      "contentHash": "0dd353296e02e448dcc653028fd3b3ce6ad7fdd8e11a1ce11a465b46f0b471d7"
    },
    {
      "entryId": "nt51930-family",
      "kind": "firmware-family",
      "path": "families/nt51930.json",
      "schemaId": "https://example.invalid/nfc/schemas/firmware-family-v1.schema.json",
      "contentHash": "c67d954bfef9cd946b4fe8c4550e222fcbe8c0c4f6e92c0dfef652cc36e8c0a2"
    },
    {
      "entryId": "nt51930-general-merge-logical-candidate-profile",
      "kind": "composition-profile",
      "path": "profiles/nt51930-general-merge-logical-candidate.json",
      "schemaId": "https://example.invalid/nfc/schemas/composition-profile-v2.schema.json",
      "contentHash": "a713be0b8e109b4f88e94b783ce5c386600ce7cc548fff1b85ca7e13474128eb"
    }
  ]
}
